id,topic,type,question,option1,option2,option3,option4,correct_option,correct_option_number
34634657,Depression,Factoid,What was one of the most frequently used keywords in publications related to mental health and depression during COVID-19?,Depression,Bipolar disorder,Anxiety,Schizophrenia,Depression,1
37680513,Depression,Preventive,How can acute aerobic exercise impact the emotional state of rheumatoid arthritis patients as indicated by their BDNF levels?,Worsen depressive symptoms,Reduce anxiety and depression,No effect on emotional state,Increase emotional resilience,Reduce anxiety and depression,2
34690248,Depression,Prognostic,"How do combinations of depression, anxiety, and stress affect oral health-related quality of life in periodontitis patients?",No effect on OHRQoL,Improve OHRQoL,Enhance periodontal health,Worsen OHRQoL,Worsen OHRQoL,4
34266302,Depression,Factoid,Which factor is associated with lower antidepressant treatment effectiveness in patients with comorbid chronic pain?,Type of antidepressant used,Older age,Genetic liability to chronic pain,Duration of depression,Genetic liability to chronic pain,3
22325750,Depression,Diagnostic,What mental health concern might arise during adolescence particularly in those affected by severe acne?,Obsessive-compulsive disorder,Generalized anxiety disorder,Psychological disturbances,Bipolar disorder,Psychological disturbances,3
33276989,Depression,Preventive,What is an important consideration for policies aimed at improving child motor development concerning antidepressant exposure during pregnancy?,Focusing on gestational age alone,Increasing dosage during pregnancy,Assessing the timing of antidepressant exposure,Eliminating all antidepressant use,Assessing the timing of antidepressant exposure,3
24134359,Depression,Prognostic,What is a significant factor that could enhance the risk of suicide within the first six months following discharge from a nursing home?,Effective discharge planning,Cognitive decline,Advanced age,Post-discharge follow-up,Post-discharge follow-up,4
34841537,Depression,Preventive,What is associated with poorer mental health outcomes in postpartum women concerning the timing of mastitis and antibiotic treatment?,Pumping milk instead of breastfeeding,Absence of family support,Late-onset mastitis with antibiotic treatment,Earliest onset mastitis without antibiotic treatment,Earliest onset mastitis without antibiotic treatment,4
35773784,Depression,Factoid,Which brain region showed reduced engagement in both depressive and bipolar disorders compared to healthy controls during working memory tasks?,Dorsolateral prefrontal cortex,Thalamus,Cerebellum,Hippocampus,Dorsolateral prefrontal cortex,1
30502560,Depression,Diagnostic,Which dimension of emotion dysregulation was significantly associated with suicidal ideation among adolescent inpatients?,Excessive emotional expression,Limited access to emotion regulation strategies,High self-esteem,Resilience to stress,Limited access to emotion regulation strategies,2
27367831,Depression,Diagnostic,What factors are significantly associated with anxiety and depression in rheumatoid arthritis patients?,Male gender,Low education level,High socioeconomic status,Increased age,Low education level,2
35970022,Depression,Diagnostic,"Which common heritable condition was mentioned as frequently overlapping with substance use disorders, potentially influencing depressive outcomes?",Chronic pain,Hypertension,Diabetes,Asthma,Chronic pain,1
34735212,Depression,Prognostic,What aspect of psychiatric complexity in veterans with depression is associated with worse mental health outcomes at follow-up?,High medical multimorbidity,Recent trauma exposure,Increased social support,Low treatment adherence,High medical multimorbidity,1
37520902,Depression,Prognostic,What changes in habits among university students during the COVID-19 pandemic were associated with an increase in mental health difficulties?,Delayed sleep and meal times,Enhanced social interactions,Increased physical activity,Reduced screen time,Delayed sleep and meal times,1
24991620,Depression,Prognostic,What factor is identified as having a significant role in predicting methadone poisoning incidents among patients?,History of psychiatric disorder,Gender of the patient,Living conditions,Age of the patient,History of psychiatric disorder,1
24242149,Depression,Diagnostic,What common psychiatric symptoms were reported by GHB-dependent patients during detoxification?,Obsessive-compulsive disorder,Severe co-occurring depression and anxiety,Psychosis,Bipolar disorder,Severe co-occurring depression and anxiety,2
23248334,Depression,Factoid,What type of seizures did the patient experience after receiving electroconvulsive therapy for treatment-resistant depression?,Atypical absence seizures,Myoclonic seizures,Focal seizures,Generalized tonic-clonic seizures,Atypical absence seizures,1
37207727,Depression,Diagnostic,Which brain regions are associated with alterations in emotional processing related to suicidal ideation in depression?,Cingulate cortex and hippocampus,Basal ganglia and brainstem,Occipital and cerebellar regions,"Frontal, temporal, and parietal lobes","Frontal, temporal, and parietal lobes",4
34233983,Anxiety,Preventive,What type of support intervention is designed to reduce parental stress in families with high-risk infants?,Psychoanalytic Therapy,Mindfulness-Based Stress Reduction,Cognitive Behavioral Therapy,Acceptance and Commitment Therapy,Mindfulness-Based Stress Reduction,2
31084447,Depression,Prognostic,Moving to a higher altitude is likely to lead to which outcome concerning psychiatric symptoms?,Decreased incidence of depression,Increased symptoms of depression,Stable mental health,Decreased risk of anxiety,Increased symptoms of depression,2
28277055,Depression,Preventive,What elements are identified as crucial for enhancing the efficacy of internet-mediated cognitive behavioral therapy (iCBT) for depression?,Use of advanced technology,Face-to-face therapist interactions,Regular online quizzes,Self-paced learning,Face-to-face therapist interactions,2
34762922,Depression,Prognostic,What effect can the restoration of insulin and leptin sensitivity potentially have on neuropsychiatric diseases such as depression?,It may reverse cognitive deficits,It may enhance leptin resistance,It may worsen depressive symptoms,It may increase metabolic disorders,It may reverse cognitive deficits,1
32347427,Depression,Preventive,What intervention might improve mental health treatment receipt among Asian Americans experiencing mental health problems?,Mandated health check-ups,Improved cultural competence of therapists,Increased insurance coverage,Wider medication availability,Improved cultural competence of therapists,2
20461303,Depression,Diagnostic,What is the most common psychiatric diagnosis among adolescents who have attempted suicide compared to those who have not?,Schizophrenia,Depressive disorder,Bipolar disorder,Anxiety disorder,Depressive disorder,2
22531571,Depression,Prognostic,What factors are predicted to influence health care utilization related to depressive symptoms among elderly individuals?,Urban living,Chronic diseases,Age of retirement,Higher education,Chronic diseases,2
33691368,Depression,Diagnostic,What occupational stress factors are identified as risk factors for depressive symptoms among fire fighters?,Work-life balance,Physical fitness,Sleep disorder,Job satisfaction,Sleep disorder,3
34669239,Anxiety,Preventive,What strategies can be implemented to improve conjoint coping in young couples affected by breast cancer?,Psychotherapy sessions,Couple communication workshops,Online forums,Educational seminars,Online forums,3
27858220,Depression,Diagnostic,Which cognitive factor is indicated to mediate the relationship between fear-avoidance cognitions and quality of life in chronic low back pain patients?,Social support,Anxiety,Depression,Catastrophizing,Catastrophizing,4
36336363,Depression,Prognostic,How could preserving neural stem cells be beneficial for astronauts during long-term space missions?,Increase appetite,Improve sleep patterns,Minimize anxiety and depression,Enhance physical strength,Minimize anxiety and depression,3
21970078,Depression,Prognostic,How does social isolation impact the likelihood of depressive symptoms in elderly individuals living alone compared to those with social contact?,Decreases likelihood of depression,Has no significant effect,Increases likelihood of depression,Maintains stable mental health,Increases likelihood of depression,3
32162056,Depression,Prognostic,How might a model developed in Brazil predict the risk of depression in adolescents from culturally distinct backgrounds?,Through sociodemographic predictors,By utilizing genetic factors,By employing environmental stressors,By assessing nutritional habits,Through sociodemographic predictors,1
19882238,Depression,Diagnostic,What role do cultural orientations of parents play in the relationship between perceived discrimination and depression among Mexican-origin adolescents?,They increase depression risks,They are only relevant for mothers,They have no influence,They serve as protective and vulnerability factors,They serve as protective and vulnerability factors,4
28041985,Depression,Diagnostic,Which inflammation-related biomarker is associated with depressive symptoms in recently diagnosed type 2 diabetes?,High-sensitivity C-reactive protein,Interleukin-6,Adiponectin,Soluble E-selectin,High-sensitivity C-reactive protein,1
34231201,Depression,Prognostic,How does the number of traumatic brain injuries relate to the risk of developing depression over time?,Higher number correlates with increased risk,Fewer TBIs increase depression risk,No relation between TBIs and depression risk,Only first TBIs increase risk,Higher number correlates with increased risk,1
28355346,Depression,Factoid,Which dietary pattern is associated with a higher prevalence of major depressive disorder in pregnant women?,Mediterranean dietary pattern,Low-sugar dietary pattern,Common-Brazilian dietary pattern,High-fiber dietary pattern,Common-Brazilian dietary pattern,3
37431494,Depression,Diagnostic,"In the review of mechanisms underlying disruptive mood dysregulation disorder, what cognitive bias was suggested to be prevalent in youths suffering from DMDD?",Positive interpretation bias,Negative interpretation bias,Cognitive dissonance,Social withdrawal bias,Negative interpretation bias,2
21360161,Depression,Diagnostic,What syndrome has been identified as an independent risk factor for depression in continuous ambulatory peritoneal dialysis patients?,Chronic Kidney Disease,Diabetes Mellitus,Malnutrition-Inflammation Complex Syndrome,Hypertension,Malnutrition-Inflammation Complex Syndrome,3
22592133,Depression,Prognostic,How might symptoms of depression and anxiety influence the future diagnosis of hypertension?,Only affect males,No effect on hypertension diagnosis,Increase likelihood of hypertension diagnosis,Decrease likelihood of hypertension diagnosis,Increase likelihood of hypertension diagnosis,3
22706986,Depression,Diagnostic,Which factors are significantly associated with a higher likelihood of psychiatric disorders in newly homeless young adults with a history of foster care?,Educational level,Housing instability,History of child abuse,Substance use,History of child abuse,3
27737312,Depression,Preventive,What is one major risk factor for suicide identified in the case of Robin Williams?,Relationship problems,Lack of drug use,High self-esteem,Financial stability,Relationship problems,1
35979009,Depression,Preventive,What is the primary benefit of implementing nursing interventions guided by risk prevention management in maintenance hemodialysis patients?,Decreased hospital stay duration,Improved psychological status and reduced infection rates,Increased medication compliance,Enhanced surgical recovery,Improved psychological status and reduced infection rates,2
21334495,Depression,Factoid,Which sensory function was notably decreased in young women with low mood compared to those with normal mood?,Visual acuity,Tactile sensitivity,Auditory sensitivity,Olfactory function,Tactile sensitivity,2
21752548,Depression,Diagnostic,How is the relationship between negative mood and cortisol described during pregnancy?,Strong between-person association,No association,Robust within-person association,Weak association,Robust within-person association,3
33631538,Depression,Preventive,What are the primary components identified in resilience-building programs aimed at reducing relapse in mood disorder patients?,Medication management,Occupational therapy,Physical rehabilitation,Cognitive behavioral therapy and group therapy,Cognitive behavioral therapy and group therapy,4
22241638,Depression,Prognostic,How might the presence of depression affect the quality of life in dialysis patients?,It may lead to improved nutritional status,It likely results in lower quality of life,It could cause an increase in physical health,It may have no effect on overall health,It likely results in lower quality of life,2
35592639,Depression,Diagnostic,Which type of animal models are essential for understanding the etiology of major depressive disorder and identifying sex-specific mechanisms?,Chronic stress models,Environmental stress models,Gene-targeted models,Developmental models,Chronic stress models,1
35415704,Depression,Diagnostic,"Which factor was identified as the largest contributor to variance in negative symptoms related to avolition, asociality, and anhedonia in high-risk individuals?",Anxiety,SSRI use,Disorganized communication,Depression,Depression,4
22166448,Depression,Preventive,What strategies are suggested for improving the quality of life in Parkinson's disease patients by addressing mental health issues?,Surgical interventions,Increased medication dosage,Avoiding physical activity,Education and realistic expectations,Education and realistic expectations,4
35952932,Depression,Preventive,What is a recommended approach to reduce healthcare resource utilization for patients misdiagnosed with major depressive disorder?,Early intervention diagnosis,Monitoring medication side effects,Increased therapy sessions,Community support programs,Early intervention diagnosis,1
36004528,Depression,Preventive,What potential intervention strategies are suggested for addressing maladaptive eating behaviors associated with mood disorders?,Mindfulness meditation,"Psychotherapeutic, pharmacological and nutritional",Electroconvulsive therapy,Physical exercise,"Psychotherapeutic, pharmacological and nutritional",2
27605454,Depression,Diagnostic,Which external factor was linked with higher suicidal risk in patients with major depressive disorder?,High socioeconomic status,Presence of supportive family,Successful treatment responses to therapy,History of suicide attempts in a relative,History of suicide attempts in a relative,4
21898310,Anxiety,Preventive,What preventative strategy has been shown to reduce the incidence of depressive and anxiety disorders among older adults?,Community support groups,Stepped-care approach,Mindfulness practices,Regular exercise programs,Stepped-care approach,2
27888723,Depression,Diagnostic,Which cognitive domain showed better performance in bipolar disorder patients compared to schizophrenia patients within a certain cluster?,Social cognition,Perception,Memory,Nonsocial cognition,Social cognition,1
24176645,Depression,Diagnostic,Which aspect of assessment is significantly influential in determining the prevalence of suicidal ideation among patients with major depressive disorder?,Type of therapy received,Patient age,Duration of depression,Method of assessment,Method of assessment,4
34653499,Depression,Prognostic,How might different diet types influence the vulnerability to depressive-like phenotypes in stressed mouse models?,Increase vulnerability,No effect,Alter microbiota composition,Decrease vulnerability,Increase vulnerability,1
35289304,Anxiety,Preventive,What intervention may help in reducing patient anxiety regarding breast pain referrals in primary care?,Follow-up phone consultations,Referral to a specialist clinic,Public awareness campaigns,Immediate imaging procedures,Immediate imaging procedures,4
39038039,Depression,Diagnostic,What significant factors are identified as influencing the mental health of older individuals with suicidal ideation?,Personal relationships,Employment status,Household income,Geographic location,Household income,3
15014598,Depression,Factoid,Which hormone is frequently elevated in patients exhibiting hypothalamic-pituitary-adrenal axis activation associated with major depressive disorder?,Serotonin,Cortisol,Adrenaline,Dopamine,Cortisol,2
22571805,Depression,Factoid,Which emotional condition was associated with greater right amygdala activity in adults with major depressive disorder?,Angry,Sad,Fearful,Happy,Happy,4
35691124,Anxiety,Preventive,Which factors are crucial in determining the outcomes of cognitive behavioral therapy for sports-betting-related gambling disorders?,Severity of gambling disorder,Level of financial stability,Educational background,Social support networks,Severity of gambling disorder,1
34498323,Depression,Factoid,"In older adults with chronic disease, which of the following factors was significantly associated with sleep disturbances?",Younger age,Living alone,Higher income,Higher levels of physical pain,Higher levels of physical pain,4
21050149,Depression,Factoid,Which mental health condition is associated with a higher likelihood of suicidal thoughts and attempts among pregnant women?,Bipolar Disorder,Personality Disorder,Schizophrenia,Anxiety,Anxiety,4
35748029,Depression,Preventive,What innovative approach does the WoebotÂ® (WB001) utilize for the treatment of postpartum depression?,Agent-guided cognitive behavioral therapy,Electroconvulsive therapy,Pharmaceutical intervention,Psychodynamic therapy,Agent-guided cognitive behavioral therapy,1
28291302,Depression,Prognostic,What effect might group-based psychosocial interventions based on cognitive behavioral therapy have on depression in adults living with HIV after participation?,Sustain improvement,Maintain baseline levels,Worsen outcomes,Increase symptoms,Sustain improvement,1
21480009,Depression,Factoid,Which mental health condition was notably elevated among adults caring for orphaned children in an HIV-endemic community?,Depression,Obsessive-compulsive disorder,Anxiety,Post-traumatic stress,Depression,1
28611690,Depression,Preventive,How might abstract verbal processing during the recall of aversive memories affect individuals with low depressive symptoms?,Diminished affective responses,Heightened self-awareness,Increased emotional distress,Encouraged ruminative thoughts,Diminished affective responses,1
23300122,Anxiety,Preventive,What type of intervention is suggested as a promising treatment for anxiety disorders based on contemporary research?,Medication,Dietary Supplements,Psychotherapy,Exercise,Psychotherapy,3
27997222,Depression,Diagnostic,"What psychological factors were identified as influencing empathy levels in medical students, particularly in relation to spirituality openness and depression?",Burnout and wellness,Depression and spiritual openness,Anxiety and stress,Quality of life and social support,Depression and spiritual openness,2
21199861,Depression,Prognostic,Which psychological factor significantly predicts the progression from acute low back pain to persistent low back pain?,Chronic pain history,Physical activity,Anxiety levels,Depression and maladaptive cognitions,Depression and maladaptive cognitions,4
34566789,Depression,Prognostic,How does social support during pregnancy correlate with subjective well-being in pregnant women?,It has no impact,It has a positive impact,It has a negative impact,It varies greatly,It has a positive impact,2
33871268,Depression,Diagnostic,Which factor is identified as a significant risk for depression in children and their parents within families?,Excessive screen time,Presence of social disadvantages,High academic performance,Low physical activity,Presence of social disadvantages,2
36380363,Depression,Preventive,What integrated approach has emerged as a promising strategy to enhance care for individuals with eating disorders?,Routine check-ups,Inpatient programs,Stepped care models,Group therapy,Stepped care models,3
35586411,Depression,Preventive,Which cognitive factor mediates the relationship between ketamine treatment and reductions in suicidal ideation?,Listening skills,Attention span,Process speed,Visual learning,Process speed,3
12471857,Depression,Diagnostic,Which substance misuse is mentioned as a possible method for suicide in diabetic patients?,Cocaine use,Alcohol consumption,Insulin overdose,Heroin overdose,Insulin overdose,3
21785291,Depression,Preventive,What is a recommended strategy for increasing advance care planning rates among individuals at risk for cognitive impairment?,Increase social activities,Limit medical interventions,Focus on younger adults,Involve family members,Involve family members,4
23053218,Depression,Preventive,What intervention strategy incorporates partners to improve treatment outcomes for women with major depressive disorder during the perinatal period?,Cognitive Behavioral Therapy,Medication Management,Mindfulness-Based Stress Reduction,Partner-Assisted Interpersonal Psychotherapy,Partner-Assisted Interpersonal Psychotherapy,4
35837127,Depression,Preventive,Which gut microbial family is significantly increased by the administration of Lactobacillus paragasseri OLL2809 in a mouse model of depression-like behavior?,Enterobacteriaceae,Bacteroidaceae,Akkermansia,Firmicutes,Akkermansia,3
21903027,Depression,Preventive,Which condition is associated with increased difficulty in responding to sertraline treatment for depression in patients with coronary heart disease?,Type 2 diabetes mellitus,Obstructive sleep apnea/hypopnea syndrome,Chronic obstructive pulmonary disease,Hypertension,Obstructive sleep apnea/hypopnea syndrome,2
37956479,Depression,Prognostic,How does the phenomenon of critical slowing down (CSD) potentially aid in predicting depressive relapse?,By signaling changes in symptom autocorrelations,By improving treatment adherence,By indicating increased symptom severity,By enhancing emotional resilience,By signaling changes in symptom autocorrelations,1
33559436,Depression,Preventive,What intervention may help alleviate negative emotions associated with Crohn's disease patients at moderate active stages?,Increased physical exercise,Nutritional dietary changes,Regular cognitive-behavioral counseling,Acupuncture-moxibustion therapy,Acupuncture-moxibustion therapy,4
28602445,Depression,Diagnostic,Which psychiatric condition was associated with an increased risk of recurrent Takotsubo cardiomyopathy?,Schizophrenia,Mood disorders,Anxiety disorders,Obsessive-compulsive disorder,Mood disorders,2
33257042,Depression,Preventive,What intervention is noted as potentially protective against the risk of developing psoriasis in patients with major depressive disorder?,Counseling,Low-dose antidepressants,Physical exercise,Meditation,Low-dose antidepressants,2
27781337,Depression,Prognostic,What attentional deficits may predict functional remission in patients recovering from a major depressive episode?,Severity of depressive symptoms,Number of omission mistakes on attention tests,Age of patient,Duration of depressive episode,Number of omission mistakes on attention tests,2
22875545,Depression,Preventive,Which therapeutic approach has shown efficacy in reducing symptoms of depression following a traumatic brain injury?,Mindfulness-Based Cognitive Therapy,Pharmacotherapy,Cognitive Behavioral Therapy,Exposure Therapy,Mindfulness-Based Cognitive Therapy,1
34880788,Depression,Preventive,"What strategies were suggested to improve care for patients with mental disorders and chronic physical illnesses, particularly to reduce emergency department use?",Intensive case management,Frequent outpatient visits,Strict medication adherence,Increased hospitalization,Intensive case management,1
35229052,Anxiety,Preventive,What coping strategy reported by participants may contribute positively to their willingness to quit smoking?,Meditation,Social support,Physical activity,Stress management,Stress management,4
36239414,Depression,Prognostic,What long-term therapy approach showed more success in restructuring chronic depression compared to its counterpart?,Cognitive Behavioral Therapy,Psychodynamic Therapy,Humanistic Therapy,Group Therapy,Psychodynamic Therapy,2
35185431,Depression,Preventive,Which intervention is suggested to improve resilience and reduce stress in healthcare settings?,Engaging in light exercise,Watching kindness media,Participating in solitary activities,Focusing on work-related stress,Watching kindness media,2
35345734,Depression,Diagnostic,What symptom was reported in 24% of participants as a result of the COVID-19 pandemic among Ontario's youth?,Depression,Insomnia,Anxiety,Schizophrenia,Depression,1
22956053,Depression,Prognostic,How might placement of a care recipient in a nursing home influence the mastery perceptions of caregivers over time?,Increase in mastery after placement,Decrease in mastery after placement,No change in mastery,Immediate improvement in mastery,Increase in mastery after placement,1
28236693,Depression,Diagnostic,What underlying factor is identified as moderating theory of mind (ToM) abilities in individuals with major depressive disorder?,Medication adherence,Social support,Attachment style,Cognitive impairment,Attachment style,3
