id,topic,type,question,option1,option2,option3,option4,correct_option,correct_option_number
28615767,Depression,Diagnostic,Which subgroup reported lower perceived social support when compared to adjustment disorder patients?,Recurrent depressive disorder patients,Anxiety disorder patients,Healthy individuals,First-episode depression patients,Recurrent depressive disorder patients,1
17291595,Obsessive/Compulsive Disorders,Factoid,Which group of patients exhibited lower levels of whole blood serotonin compared to healthy volunteers?,Healthy controls,Those with social anxiety disorder,Schizophrenic patients without obsessive-compulsive symptoms,Patients with obsessive-compulsive disorder,Patients with obsessive-compulsive disorder,4
38514191,Obsessive/Compulsive Disorders,Prognostic,How does the overexpression of the Slc1a1 gene in forebrain neurons potentially influence the response to amphetamine in relation to obsessive-compulsive disorder behaviors?,Decreases hyperactivity,Diminishes nerve response,Reduces locomotion,Increases stereotypy,Increases stereotypy,4
12787851,Obsessive/Compulsive Disorders,Preventive,"What treatment was shown to gradually decrease stereotypic behaviors in captive primates, which are similar to human obsessive-compulsive symptoms?",Behavioral modification training,Cognitive-behavioral therapy,Risperidone,Fluoxetine,Fluoxetine,4
24480417,Obsessive/Compulsive Disorders,Preventive,How does maternal obsessive-compulsive disorder during pregnancy potentially affect fetal brain development?,By reducing maternal anxiety symptoms,By decreasing fetal TNF-Î± levels,By improving maternal mental health,By increasing fetal neuroinflammation,By increasing fetal neuroinflammation,4
22402913,Anxiety,Preventive,Which type of training is proposed to help manage anxiety and improve performance in basketball players?,Cognitive-behavioral therapy,Physical endurance training,Nutritional supplementation,Heart rate variability biofeedback,Heart rate variability biofeedback,4
23469704,Anxiety,Prognostic,How does variability in anxiety levels potentially influence individual differences in olfactory perception?,No impact on olfactory perception,Increases sensitivity to odors,Affects olfactory memory,Decreases odor identification,Increases sensitivity to odors,2
33305979,Anxiety,Factoid,What psychological symptoms showed a significant decrease in patients after participating in the Mindful Awareness Practices program for adults with ADHD?,Post-traumatic stress symptoms,ADHD symptoms,Obsessive thoughts,Bipolar symptoms,ADHD symptoms,2
36156917,Anxiety,Prognostic,How might an increase in screen time during the pandemic impact adolescents' mental health?,It may correlate with worsening emotions and mental health outcomes,It will have no significant effect,It is likely to enhance social interactions,It could lead to improved academic performance,It may correlate with worsening emotions and mental health outcomes,1
35138557,Anxiety,Diagnostic,What aspect of visual attention was shown to be atypical in autistic children during face observation?,Indifference to facial expressions,Preference for mouth gaze,Quick orientation away,Gaze avoidance,Gaze avoidance,4
16687991,Anxiety,Preventive,What is a recommended strategy for managing co-occurring anxiety in individuals with pathological gambling?,Escitalopram treatment,Psychotherapy alone,Antipsychotic augmentation,Avoiding all medications,Escitalopram treatment,1
33658957,Anxiety,Prognostic,How might fear of COVID-19 influence aggressive behaviors in online environments during a pandemic?,Via enhanced empathy,By improving social interactions,By increasing pro-social behaviors,Through moral disengagement,Through moral disengagement,4
36246683,Anxiety,Preventive,What approach may effectively lower psychological cravings in patients undergoing rehabilitation from alcohol dependence?,Individual cognitive therapy,Pharmacological treatment alone,Family therapy only,Grouping motivational interviewing,Grouping motivational interviewing,4
33567978,Anxiety,Prognostic,Which demographic factor was identified as a protective influence against depression during quarantine periods among individuals?,Older age,High education level,Being male,Living with children,Living with children,4
21491216,Anxiety,Preventive,What benefit is associated with the involvement of multiple caregivers in cognitive-behavioral therapy for anxiety in dementia patients?,Enhanced treatment documentation,Increased medication compliance,Reduction in caregiver burnout,Improved family communication,Improved family communication,4
22503436,Anxiety,Prognostic,Which specific anxiety disorder has been shown to predict the onset of alcohol use disorders in adolescents?,Post-traumatic stress disorder,Generalized anxiety disorder,Panic disorder,Social anxiety disorder,Social anxiety disorder,4
35150311,Anxiety,Prognostic,How does maternal psychological distress during pregnancy influence the likelihood of elective cesarean sections?,Increases likelihood,No effect,Decreases likelihood,Only affects labor duration,Increases likelihood,1
34845946,Anxiety,Diagnostic,What emotional challenges are typically faced by patients diagnosed with multi-drug-resistant tuberculosis?,Euphoria about treatment,Indifference to diagnosis,Fear of death,Complete optimism,Fear of death,3
22717171,Anxiety,Diagnostic,"Which biological factor may explain the relationship between severe anxiety disorders, depression, and cardiovascular disease risk?",Dietary habits,Genetic predispositions,Autonomic nervous system activity,HPA axis dysregulation,HPA axis dysregulation,4
34366966,Anxiety,Prognostic,How might attachment style influence the quality of romantic relationships during stressful circumstances?,Anxious attachment improves relationship quality,Attachment style is irrelevant to relationship quality,Avoidant attachment has no impact,Anxious attachment diminishes relationship quality,Anxious attachment diminishes relationship quality,4
22230806,Anxiety,Diagnostic,What type of early life stress has been shown to lead to an anxious/depressive phenotype in rats?,Social isolation,Chronic pain,Food deprivation,Prenatal restraint stress,Prenatal restraint stress,4
36062470,Anxiety,Prognostic,What impact does a positive autism identity have on social anxiety in autistic young people?,It only affects physical health,It increases social anxiety,It may alleviate social anxiety,It has no effect,It may alleviate social anxiety,3
22775580,Anxiety,Factoid,"In comparison to clinically anxious children without autism spectrum disorders, which type of anxiety disorder was reported to be more prevalent in children with high-functioning autism?",Panic disorder,Specific phobias,Generalized anxiety disorder,Social anxiety disorder,Specific phobias,2
21247477,Anxiety,Diagnostic,What role does the anterior cingulate cortex play in the regulation of anxiety-like behavior in adult mice?,It enhances cognitive functioning,It increases neurogenesis,It modulates anxiety-like behavior,It reduces symptoms of depression,It modulates anxiety-like behavior,3
34931763,Anxiety,Diagnostic,What type of anxiety was more frequently reported by parents of preschool children during the COVID-19 curfew?,Performance anxiety,General anxiety,Separation anxiety,Social anxiety,Separation anxiety,3
21769772,Anxiety,Factoid,Which selective serotonin reuptake inhibitor is noted to be effective in treating social anxiety disorder in a patient with pervasive developmental disorder?,Paroxetine,Escitalopram,Fluvoxamine,Sertraline,Fluvoxamine,3
32510786,Anxiety,Preventive,What role do early anxiety symptoms play in the long-term clinical outcomes of individuals experiencing first-episode psychosis?,Aid in early diagnosis,Promote remission,Worsen clinical status,Predict better functioning,Predict better functioning,4
23047429,Anxiety,Prognostic,How might poor sleep quality influence anxious reactivity in individuals with a history of PTSD?,It only affects those without PTSD,It increases anxious responses to trauma cues,It has no effect on anxious responses,It decreases overall anxiety,It increases anxious responses to trauma cues,2
35472479,Anxiety,Preventive,What strategy can higher education institutions adopt to alleviate the impact of anxiety on e-learning intentions among college students?,Decrease course workload,Increase face-to-face interactions,Focus on physical education programs,Improve perceived usefulness of e-learning,Improve perceived usefulness of e-learning,4
23161356,Anxiety,Preventive,What psychological condition is associated with unexpected explicit recall during general anaesthesia?,Anxiety,Post-traumatic stress disorder,Depression,Obsessive-compulsive disorder,Post-traumatic stress disorder,2
23312082,Anxiety,Diagnostic,What type of behavioral intervention is suggested to decrease anxiety levels in adolescent rats?,Increased cage size,Handling,Isolation,Medication,Handling,2
22039971,Anxiety,Diagnostic,What aspect of anxiety is significantly correlated with experienced sensory pain during labor?,State Anxiety,Trait Anxiety,Anxiety Sensitivity,Postpartum Anxiety,Anxiety Sensitivity,3
22410505,Anxiety,Diagnostic,What condition is commonly associated with heightened sleep disturbances in adolescents admitted to psychiatric facilities?,Hyperarousal,Self-harm behavior,Dysthymia,Poor sleep hygiene,Hyperarousal,1
34208457,Anxiety,Diagnostic,What relationship does differentiation of self have with psychological adjustment post-separation?,Low differentiation enhances conflict,High differentiation causes anxiety,High differentiation is linked to better coping,Separation has no effect on differentiation,High differentiation is linked to better coping,3
34375211,Anxiety,Factoid,Which hormone was identified as being marginally associated with elevated anxiety scores in adolescents?,Testosterone,Thyroxine,Insulin,Prolactin,Testosterone,1
11206029,Anxiety,Diagnostic,What underlying disorders are often associated with social anxiety disorder that can further impair functionality?,Psychosis,Personality disorders,Bipolar disorder,Mood and substance abuse disorders,Mood and substance abuse disorders,4
35855240,Anxiety,Preventive,Which factor significantly impacts the willingness to practice meditation for anxiety management during the pandemic?,Gender and lifestyle choices,Age and comorbidity symptoms,Education level and job stability,Marital status and income level,Age and comorbidity symptoms,2
25495066,Anxiety,Diagnostic,What type of negative thought process is suggested to potentially give rise to symptoms characteristic of generalized anxiety disorder and obsessive compulsive disorder?,Sadness,Worry,Rumination,Fear,Worry,2
36618717,Anxiety,Preventive,What intervention method showed promise in supporting mental health during the COVID-19 pandemic in vulnerable populations?,Meditation retreats,Medication management,Digital Psychological First Aid,In-person group therapy,Digital Psychological First Aid,3
36168097,Anxiety,Preventive,What intervention can be used to manage anxiety symptoms in patients undergoing chemotherapy?,Music therapy,Cognitive-behavioral therapy,Exercise,Medication,Cognitive-behavioral therapy,2
28544955,Anxiety,Factoid,Which emotional symptom was associated with fewer negative cigarette effects in adolescents?,Major Depressive Disorder,Social Anxiety Disorder,Panic Disorder,Generalized Anxiety Disorder,Major Depressive Disorder,1
32389148,Anxiety,Diagnostic,Which factors related to childhood experiences were associated with increased risks of psychological distress in health professional students?,High academic performance,Positive family relationships,Childhood adversity,Stable mental health,Childhood adversity,3
35919807,Anxiety,Preventive,What strategies can be implemented in psychiatric settings to effectively reduce medication errors during patient transitions of care?,Medication audits,Regular patient follow-ups,Therapeutic education for caregivers,Increased medication storage,Medication audits,1
21316266,Anxiety,Factoid,What was the most frequent psychiatric disorder diagnosed among patients with temporal lobe epilepsy with mesial temporal sclerosis?,Psychotic disorders,Obsessive-compulsive disorders,Depressive disorders,Anxiety disorders,Depressive disorders,3
33170956,Anxiety,Diagnostic,What is a common emotional response reported by patients suffering from immune thrombocytopenia upon receiving a delayed diagnosis?,Frustration,Depression,Anxiety,Indifference,Frustration,1
23127351,Anxiety,Prognostic,How might partner behaviors in coping potentially influence stress recovery in individuals with attachment anxiety?,Worsen stress recovery,Create emotional distance,Have no effect,Enhance recovery speed,Enhance recovery speed,4
27667748,Anxiety,Prognostic,How does the interaction between pain intensity and experiential avoidance relate to the severity of anxiety symptoms among economically disadvantaged Latinos?,Indicating lower anxiety levels,Suggesting increased anxiety symptoms,Proposing no relationship,Reflecting better coping mechanisms,Suggesting increased anxiety symptoms,2
34518795,Anxiety,Prognostic,What has been suggested to improve the mental well-being of individuals experiencing psychological stress due to COVID-19?,Isolation measures,Increased medication,Avoidance strategies,Coping strategies,Coping strategies,4
34346493,Anxiety,Prognostic,How might chronic stress exposure impact the anxiety-related behaviors in individuals experiencing stress-related disorders?,Decrease in anxiety-like behaviors,No impact on anxiety,Increase in cognitive function,Increase in anxiety-like behaviors,Increase in anxiety-like behaviors,4
32180026,Anxiety,Prognostic,How might higher levels of GAD literacy affect adolescents' future intentions to seek help for anxiety disorders?,Increase help-seeking intentions,Decrease help-seeking intentions,Worsen their anxiety symptoms,Have no effect,Increase help-seeking intentions,1
21782853,Anxiety,Prognostic,"How does aging impact the reactivity of the fear/anxiety circuit in Lewis rats, particularly in relation to anxiety levels?",Decreased anxiety levels,No impact on anxiety levels,Increased neuronal activation,Increased anxiety and enhanced reactivity,Increased anxiety and enhanced reactivity,4
21848717,Anxiety,Preventive,What strategies could enhance reflective learning and reduce anxiety levels in occupational therapy education?,Eliminating self-evaluation,Promoting current critical incident analysis,Focusing solely on past incidents,Minimizing group discussions,Promoting current critical incident analysis,2
33067166,Anxiety,Preventive,Which of the following factors is suggested to help promote mental health resilience in adolescents?,Engagement in physical activity,Sedentary lifestyle,Social isolation,High academic pressure,Engagement in physical activity,1
23459637,Anxiety,Diagnostic,"In patients with borderline personality disorder, how does trait anxiety influence cognitive performance during emotional interference tasks?",it enhances emotional regulation,it improves overall memory,it decreases amygdala activation,it correlates with longer reaction times,it correlates with longer reaction times,4
23121339,Anxiety,Prognostic,What is likely to happen to individuals who engage in both forced and voluntary wheel running in terms of their anxiety-related responses to stress?,Worsened stress perception,Unchanged anxiety levels,Increased anxiety,Reduced anxiety-related responses,Reduced anxiety-related responses,4
34668126,Anxiety,Diagnostic,How are emotional and behavioral problems associated with the severity of autism spectrum disorder symptoms?,Inversely correlated,No correlation,Positively correlated,Negatively correlated,Positively correlated,3
34426796,Anxiety,Prognostic,How does the fear of COVID-19 correlate with symptoms of depression and anxiety among adults during the pandemic?,Positively correlated,Negatively correlated,Unpredictable correlation,No correlation,Positively correlated,1
22250896,Anxiety,Prognostic,How does the frequency of perceived discrimination relate to psychological distress when events are rated with low stress?,It reduces distress,It has no relationship,It predicts greater distress,It only affects depression,It predicts greater distress,3
34937473,Anxiety,Factoid,What patient-reported outcome measure showed significant improvement after treatment with cannabis for generalized anxiety disorder?,Visual Analog Scale,Sleep Quality Index,General Anxiety Disorder Scale,Quality of Life Scale,General Anxiety Disorder Scale,3
23227331,Anxiety,Diagnostic,Which psychiatric condition is linked to the sensory dimension of pain experience in patients with breast cancer?,Depression,Insomnia,Stress,Anxiety,Anxiety,4
21773789,Anxiety,Diagnostic,Which psychological condition remained elevated in a significant subgroup of patients after ICD implantation?,Vital exhaustion,Generalized anxiety disorder,Mania,Post-traumatic stress disorder,Post-traumatic stress disorder,4
23110820,Anxiety,Prognostic,How is the craving for methamphetamine expected to be influenced by negative mood states during detoxification in female users?,Temporarily reduced,Decreased,Unchanged,Increased,Increased,4
34978279,Anxiety,Prognostic,How does the incidence of insomnia compare between patients with sudden sensorineural hearing loss and those without this condition?,Higher in SSNHL patients,Higher in non-SSNHL patients,Lower in SSNHL patients,The same,Higher in SSNHL patients,1
22286854,Anxiety,Prognostic,How might heightened morning cortisol levels in IBS patients indicate potential psychosocial vulnerabilities?,Demonstrate improved emotional stability,Suggest lower stress susceptibility,Increase resilience to stress,Indicate potential for increased stress responses,Indicate potential for increased stress responses,4
34010760,Anxiety,Prognostic,How may perceived distress tolerance influence future substance use patterns in adolescents?,Have no effect over time,Act as a protective factor,Increase likelihood of substance use,Enhance craving for substances,Act as a protective factor,2
36777316,Anxiety,Prognostic,"What is a potential risk associated with the concurrent use of gabapentin, opioids, and benzodiazepines in patients with mental health conditions?",Enhanced mental clarity,Increased odds of respiratory depression,Improved pain management,Reduced anxiety levels,Increased odds of respiratory depression,2
32567103,Anxiety,Preventive,"Which therapeutic approach shows promise in preventing nightmares, thereby potentially reducing related anxiety levels?",Exposure therapy,Cognitive restructuring,Positive reinforcement therapy,Imagery rehearsal therapy,Imagery rehearsal therapy,4
35209780,Anxiety,Diagnostic,What underlying factors were identified as barriers to mental health help-seeking behaviors among adolescents in Oman?,Access to healthcare facilities,Fear and lack of family support,Cultural stigma,Age and gender,Fear and lack of family support,2
36314294,Anxiety,Preventive,Which factor is identified as a critical mechanism to cope with mental health challenges faced by anaesthetists during the COVID-19 pandemic?,Access to personal protective equipment,Increased workload,Support from family and colleagues,Job dissatisfaction,Support from family and colleagues,3
31131742,Anxiety,Preventive,What therapeutic approach has shown promise in reducing suicide risk among older adults with anxiety disorders?,Mindfulness Meditation,Exposure Therapy,Problem-Solving Therapy,Cognitive Behavioral Therapy,Problem-Solving Therapy,3
35911212,Anxiety,Preventive,How do empathic abilities affect social behavior during acute stress in patients with social anxiety disorder?,They buffer negative effects,They increase stress response,They have no impact,They worsen anxiety,They buffer negative effects,1
28920038,Anxiety,Diagnostic,What premedication is reported to reduce preoperative anxiety with minimal cognitive impairment in elective surgery patients?,Diazepam,Ibuprofen,Ketamine,Melatonin,Melatonin,4
33970291,Anxiety,Prognostic,What condition is most likely reported among patients enrolled in the UK's first medical cannabis registry?,Obsessive-compulsive disorder,Bipolar disorder,Chronic pain,Schizophrenia,Chronic pain,3
35430271,Anxiety,Diagnostic,What long-term neuropsychiatric conditions are associated with COVID-19 infection?,Increased IQ,Autism spectrum disorder,Depression and anxiety,Schizophrenia,Depression and anxiety,3
11068140,Anxiety,Diagnostic,What factor appears to contribute to the anxiety observed in rats after excitotoxic lesions in the magnocellular nucleus basalis?,Enhanced cognitive function,Neurotransmitter imbalance,Increased cholinergic activity,Decreased serotonin levels,Neurotransmitter imbalance,2
35073805,Anxiety,Diagnostic,Which cognitive technique has been shown to reduce self-reported anxiety in imagined scenarios?,Focusing on past experiences,Increased specificity of prompts,Ignoring emotional content,Imagining negative scenarios,Increased specificity of prompts,2
35658570,Anxiety,Factoid,Which cognitive weakness is linked to higher anxiety symptoms when coupled with lower word reading scores?,Auditory Processing,Visual Perception,Processing Speed,Memory,Processing Speed,3
34020203,Anxiety,Preventive,What evidence-based strategy might help improve the mental wellbeing of parents and carers of children with developmental and epileptic encephalopathies?,Mindfulness Training,Cognitive Behavioral Therapy,Medication,Physical Activity,Mindfulness Training,1
22437546,Anxiety,Factoid,"Among children and adolescents, which symptom was identified as a more significant predictor of self-perceived quality of life?",Behavioral symptoms,Social symptoms,Depressive symptoms,Anxiety symptoms,Depressive symptoms,3
35777308,Anxiety,Diagnostic,What did the negative urgency subscale of the UPPS-P predict in relation to response inhibition?,Enhanced cognitive control under threat,Improved reaction times during stress,Impaired response inhibition under threatening conditions,No effect on response inhibition,Impaired response inhibition under threatening conditions,3
21593661,Anxiety,Factoid,Which medication has been noted for its significant impact on reducing anxiety and stress scores compared to efavirenz?,Rilpivirine,Raltegravir,Efavirenz,Atripla,Raltegravir,2
20937300,Anxiety,Preventive,"Which neuropeptide has been shown to reduce anxiety-like behavior in alcohol-preferring rats, thereby potentially serving as a preventive measure for alcohol intake?",Substance P,Neuropeptide Y,Oxytocin,Corticotropin-releasing hormone,Neuropeptide Y,2
35754367,Anxiety,Diagnostic,What factor does sleep reactivity level potentially affect regarding cognitive-behavioral therapy for insomnia treatment outcomes?,Sleep efficiency,Sleep onset latency,Sleep duration,Sleep quantity,Sleep efficiency,1
35870439,Anxiety,Diagnostic,What behavioral indicator might suggest a relationship between social media usage and psychological distress?,Elevated social media engagement,Lower communication skills,Reduced physical activity,Increased sleep quality,Elevated social media engagement,1
28810456,Anxiety,Diagnostic,Which psychological factors primarily contribute to preoperative anxiety identified in patients awaiting surgery?,Length of hospital stay,Nutritional concerns,Cost of surgery,Surgical procedures,Surgical procedures,4
22716144,Anxiety,Diagnostic,What factors have been suggested to motivate psychotic patients to use cannabis despite its adverse effects on their recovery?,To cope with physical pain,To obtain relief from depression,To enhance cognitive function,To reduce sleep disturbances,To obtain relief from depression,2
36128679,Anxiety,Prognostic,How might the presence of cognitive impairment and longer duration of psychiatric disorders affect neuroimaging outcomes in patients?,Worsening diagnostic clarity,Increased likelihood of abnormalities,Decreased need for follow-up,Improved treatment efficacy,Increased likelihood of abnormalities,2
28223059,Anxiety,Diagnostic,What condition has been proposed to describe ongoing mental health morbidity associated with fear of terrorism?,Post-traumatic stress syndrome,Anticipatory anxiety disorder,Chronic anxiety syndrome,Pre-traumatic stress syndrome,Pre-traumatic stress syndrome,4
33610705,Anxiety,Diagnostic,What factor is associated with the presence of adverse reactions when using drug-herb combinations for treating anxiety and depression?,Gender,Unemployment,Age,Education level,Unemployment,2
34389427,Anxiety,Diagnostic,What type of stimuli sensitivity is heightened by adolescent exposure to delta-9-tetrahydrocannabinol and ethanol in rodent models?,Pain stimuli,Reward stimuli,Fear stimuli,Cognitive stimuli,Fear stimuli,3
24659554,Anxiety,Diagnostic,Which neuropeptide systems are involved in regulating stress responses and associated depressive effects?,Dopamine and serotonin,GABA and glutamate,Corticotropin-releasing factor and arginine vasopressin,Norepinephrine and acetylcholine,Corticotropin-releasing factor and arginine vasopressin,3
31621951,Anxiety,Diagnostic,Which specific method of nonsuicidal self-injury was shown to have significant associations with severity of suicide attempts in patients with substance use disorders?,Burning,Minor tissue damage,Blunt force,Cutting,Cutting,4
36394284,Anxiety,Preventive,What intervention could potentially improve Australian farmers' well-being by enhancing their sense of control over daily stressors?,Enhancing internal locus of control,Increasing agricultural training sessions,Promoting external locus of control,Reducing daily stressors,Enhancing internal locus of control,1
